groups,dimensions,effect,lower,upper
White v. African Americans,Superiority,0.7370107854403827,0.33953260379349504,1.1344889670872704
White v. Asian Americans,Superiority,0.42237022708063404,0.028339754428332586,0.8164006997329355
White v. Hispanic Americans,Superiority,0.7774005086529703,0.38123859845373426,1.1735624188522062
Asian v. African Americans,Superiority,0.28214393633884727,-0.11217865333612526,0.6764665260138198
Asian v. Hispanic Americans,Superiority,0.28888373894950936,-0.11239509309919338,0.6901625709982121
African v. Hispanic Americans,Superiority,-0.008720146013957895,-0.4041993867406335,0.38675909471271774
