groups,effect,lower,upper
White v. African Americans,0.74963009206728,0.607571491060304,0.891688693074256
White v. Asian Americans,0.448867838015049,0.310033817877942,0.587701858152155
White v. Hispanic Americans,1.16957290339779,0.859973030063019,1.47917277673255
Asian v. African Americans,0.326530741527373,0.141953277402588,0.511108205652158
Asian v. Hispanic Americans,0.576512973790954,0.263433957941908,0.889591989639999
African v. Hispanic Americans,0.161016022503014,-0.0557834237194057,0.377815468725433
