groups,dimensions,effect,lower,upper
White v. African Americans,Superiority,0.701715981072939,0.3074114929365955,1.0960204692092825
White v. Asian Americans,Superiority,0.38813650786333725,-0.0049655857881088505,0.7812386015147834
White v. Hispanic Americans,Superiority,0.7942794722634052,0.39904739703738645,1.189511547489424
Asian v. African Americans,Superiority,0.2771041175617523,-0.11742449678524042,0.671632731908745
Asian v. Hispanic Americans,Superiority,0.3263491751637309,-0.0750528473036261,0.727751197631088
African v. Hispanic Americans,Superiority,0.03223329535872134,-0.36253645478815905,0.4270030455056017
